Question,Answer
معتمر حلق نصف رأسه، وترك النصف الآخر ألنه يريد أداء عمرة أخرى عن والده، هل يجوز ذلك ؟, هذه من الأفعال الغريبة التي ابتدعها بعض الناس، إذ لم يثبت عن النبي فعل ذلك، وهذا قد يدخل في باب القزع (حلق شيء من الرأس وترك الآخر) المنهي عنه. 
ما ذا يفعل من حلق شعره وكان يريد حج القران أو الإفراد؟, القص عن جهل لا يضر، لكن السنة أن يجعلها عمرة عمدا، هذا هو الأفضل، إن لم يسق معه الهدي. 
من فقد نعاله بعد العمرة. ماذا يفعل؟, ميشي حافيا حتى يشتري أخرى، ألنه يحرم عليه أخذ أي نعال آخر بدون إذن صاحبه من جوار الحرم. 
من يخاف على نفسه من حرارة الإرض وليس معه نقود ليشتري نعالا، ويوجد الكثير منها سيتلف، هل يأخذ منها؟,   الواجب أن يشتري أخرى أو يذهب حافيا، لكن إن علم أنها ليست ألحد، وأنها ملقاة لا خير فيها فلا بأس أن يأخذها. 
من نسي حلق شعره وكان يريد التمتع حتى دخل وقت الحج.. ماذا يفعل؟, له أن يحول نسكه، فيكون قارنا. 
معلوم أن من أراد أن يضحي فلا يأخذ من شعره، فماذا يفعل من انتهى من العمرة ونوى أن يضحي في بلده؟, لا بأس أن يقص من شعره ألنه ألجل التحلل من نسك وليس للزينة.   
ماذا يطلق على هذه الفترة بعد الانتهاء من العمرة؟, يقال لها فترة التمتع. 
ما المقصود بفترة التمتع؟, المقصود بها أن من انتهى من العمرة منتظرا الحج فله أن يتمتع بما كان محظورا عليه وقت الإحرام. 
هل بمقدور الزوج مجامعة الزوجة خلال هذه الفترة؟, نعم لهما ذلك، بعد الفراغ من العمرة. 
هل هناك من عبادة معينة يفعلها الحاج خلال هذه الفترة؟, يحرص على أداء الصلاة المكتوبة في وقتها جماعة، وقراءة القرآن مع الدعاء، ألنه في أيام العشر الأول من ذي الحجة وهي أيام تهليل وتكبير، مع الحرص على حضور المحاضرات. 
هل يشرع الذهاب إلى البيت الحرام للطواف تطوعا؟, هذا من الإعمال المباركة ، إن تيسر فعله من غير مزاحمة للمعتمرين فعن عبد الله بن عمر ] قال: سمعت رسول الله [ يقول: «من طاف بالبيت سبعا، وصلى ركعتن كان كعدل رقبة .» رواه ابن ماجه 
بعض الحجاج يرمي ملابس الإحرام، ليرتدي للحج ملابس   إحرام جديدة. فما التوجيه لهذا؟, هذا من إضاعة المال  ، بل نعلم أن مابس الإحرام لو كان بها وساخة فلا بأس بغسلها، ولا حرج لو لبسها بدون غسل. 
من يغسل إحرامه استعدادا ليوم التروية، فما حكم هذا؟, لا بأس بغسله ألجل النظافة. 
ما الحكم لو كان الغسل من باب الظن أن به نجاسة؟, إن كان يظن فيه شيء فهذا يحتاج إلى إثباته بدليل شرعي صحيح؛ حذرا من الدخول بالوسوسة. 
بعض الحجاج يأتون إلى مكة في وقت مبكر، وفي كل يوم ينزلون إلى المسجد الحرام للطواف والجلوس فيه، مما يحدث زحاما في المكان لكثرة القادمين للحج، فهل هذا من السنة؟, ليس من السنة للحاج أن يكثر الطواف بالبيت، والسّنة في حقه اتباع الهدي النبوي لا العاطفة في عبادته، لهذا فهناك فقط طواف القدوم والإفاضة والوداع، وهذه أطوفة نسك لا بد منها، وعمل بعض الناس من التردد يوميا على البيت في أيام الحج والطواف من غير النسك، وتضييقه المكان على المعتمرين ومزاحمته لهم قد يوقعه في الإثم. 
هل ُيشرع أداء عمرة ثانية وثالثة بعد العمرة الأولى؟, لا يشرع، وعلى المسافر أداء عمرة واحدة في كل رحلة، وهذا ما فعله النبي، وكذلك الصحابة رضي الله عنهم. 
ما حكم قصد البقاع التاريخية مثل غار حراء وثور؟, إن كان القصد للمعرفة والتعلم فلا بأس في ذلك.  
هل ُينصح بعمل محاضرات للحجاج في السكن؟, نعم وهو أمر مرغوب فيه وخصوصا للنساء، لتعليمهم وتبصيرهم بأحكام دينهم، وتحديدا في العقيدة وأحكام الطهارة والصلاة، والأمور الاخلاقية. 
هل هناك من مدة محدده لقصر الصالة؟, النبي قصر الصلاة طوال فترة الحج، بما يقارب عشرة أيام، ولو كان هناك حكم آخر لبينه [ ألمته. 
هل الصلاة في السكن تكون قصرا للرباعية؟, نعم، المشروع قصر الرباعية في فترة الحج للمسافر. 
ما حكم جمع الصلاة في مصلى السكن؟, لا بأس في ذلك إن كانت هناك حاجة وسبب. 
لو صلى الحاج مع إمام يتم صلاته. فهل يقصر الصالة؟, المسافر يصلى بصلاة الإمام، فإن أتم الصلاة أتمها معه. 
هل ُيشرع للمسافر أداء النوافل؟, نعم، يشرع له المحافظة على ركعتي الفجر والوتر. 
ما اللباس الشرعي للمرأة بني النساء؟, لها أن تلبس اللباس المعتاد بن النساء، والبأس بالزينة بينهن. 
هل الأفضل للنساء الصلاة جماعة، أم فرادى؟, تستحب صلاة الجماعة للنساء أحيانا. 
متى تستحب الصلاة جماعة للنساء؟,    ّن في الحرم فيصلين جماعة مع الناس، وإن كن في السكن فهن بالخيار، لان الجماعة لا تجب في حق النساء وغير البالغين. 
كيف تكون إمامة المرأة للنساء؟, المرأة تؤم النساء فقط، وتقف في وسط الصف الأول. 
هل يمكن صيام أيام التسع الأول من ذي الحجة في الحج؟, الحاج ليس عليه صيامها، والنبي لم يدل الحجاج إلى ذلك. 
لو دخل على الحجاج يوم الجمعة قبل الحج، فهل تجب عليهم أداء صالة الجمعة؟, لا تجب عليهم، قال النبي :[ «ليس على مسافر جمعة » رواه الطبراني. والحاج يعتبر في حكم المسافر، والواجب في حقه صلاة الظهر قصرا. 
هل الذهاب إلى جدة أو إلى المدينة النبوية وغيرهما يبطل عمرة التمتع؟, إذا ذهب الحاج إلى أي مدينة قريبة من مكة، وليست مدينته التي فيها أهله، فلا يزال يعتبر في حكم المتمتع، والعمرة الأولى باقية في حقه، ولا يلزمه أداء عمرة إن رجع إلى مكة. 
بعض الحجاج في السكن (العمارة) لا يحرصون على صالة الجماعة، ما حكم هذا التخلف؟, هذا الفعل لا ينبغي، والرجل يحرص على أداء الصلاة جماعة، مع الحضور للمحاضرات الشرعية بعد الصلاة.   
هل الأفضل الصلاة في السكن، أو الذهاب إلى الحرم؟, لا بأس بالصلاة في السكن (العمارة)، وإن تيسر الذهاب إلى الحرم من غير مشقة أو مزاحمة للمعتمرين فهذا أفضل. 
هل هناك من إثم بسبب الإكثار من الذهاب إلى الأسواق؟, الأسواق شر البقاع لمن ليس له فيها حاجة، وينبغي الحذر من الفتن التي فيها، والأولى على المسلم والمسلمة الحرص خال هذه الإيام على اغتنام الصالحات من الإعمال والأقوال. 
يرجع بعض الحجاج إلى التدخين، لانهم كما يزعمون قد انتهوا من العمرة وهم الإن متحللون، فما التوجيه لهم؟, التدخين شر وضرر يجب البعد عنه خال الإحرام خصوصا، بل وفي أي زمان ومكان، وليتق المسلم ربه أنه عند بيته المعظم وفي البلد الحرام، وضيف عليه ثم يرتكب ويجاهر بهذه الآفة، ولنتذكر أن هذه الأوقات فرصة مباركة لتعليم المسلم بأن يقلع عن هذه الآفة. 
هل ُيشرع تقبيل الحجر واستلامه في غير الطواف؟, الوارد أن استام الحجر وتقبيله لا يكون إلا في طواف. 
هل بمقدور كل من عنده علم في الحملة أن يفتي الناس؟, لا ينبغي حدوث هذا، فالفتوى العامة المتعلقة خصوصا بنسك الحج متعلقة بمرشد الحملة، وهذا ما علمنا إياه عمر ] حيث كان يجعل مفتيا واحدا للناس في مسائل الحج، إذ كثرة الآراء قد تجعل الناس في تشتت من الرأي والعمل.   
بعض النساء قد تخجل من السؤال بما يتعلق بأمور النساء، فما حكم هذا الخجل؟, هذا من الخجل المذموم، فالواجب السؤال عن كل أمر بحياتها له تعلق بالشرع، ويمكن معاجلة الخجل من خال سؤالها من خال الهاتف، أو بإرسال ورقة إلى أهل العلم.  
ما تاريخ هذا اليوم؟, الثامن من ذي الحجة. 
ما معنى يوم التروية؟, كان العرب قبل الإسلام يحضرون املاء من مكة إلى منطقة منى ليرتووا، فسمي هذا اليوم بذلك الفعل. 
ما معنى اسم (منى)؟, (منى) بالكسر لا بالضم، ويقال: فان أمنى إذا نزل مبنى.  ُيسال فيها من دماء  ُمينى أي  وسبب التسمية: لكثرة ما الأضاحي.  
هل ينبغي على مرشد الحملة تعليم الحجاج أحكام الحج؟, نعم، فقد ورد عن ابن عمر ] أنه قال: كان [ قبل يوم التروية بيوم يخطب الناس فيخبرهم بمناسكهم. 
ما أعمال هذا اليوم؟, لبس ملابس الإحرام، والاهلال بالحج من الضحى، ولا بأس به بعد الزوال (أذان الظهر)، وقصر الصلاة من دون جمع في منى، ويستحب المبيت بها. 
ما حكم أعمال هذا اليوم؟, أعمال هذا اليوم ( كالإحرام، والنزول في منى، أداء الصلوات:   الظهر، العصر، المغرب، العشاء، الفجر) مستحبة. 
ما الدليل من قول العلماء في استحباب هذا المبيت؟, ذكر ابن المنذر إجماع أهل العلم على استحباب المبيت في منى ليلة عرفة، وليس هناك شيء على تاركه. 
هل ُيشترط ارتداء ملابس الإحرام أن يكون عند بيت الله؟, لا يشترط ذلك، والنبي لم يخصص موضعا لفعل ذلك. 
هل ُيقال عند ارتداء ملابس الإحرام : نويت أن...؟, هذا القول غير مشروع، ولكن هناك الإهلال بالحج فقط يقول: (لبيك اللهم بحج.) 
متى يبتدئ الإحرام والإهلال بالحج في هذا اليوم؟, المشروع أن يكون في وقت الضحى. 
ما حكم التأخر بالإهلال للحج أو التبكير؟, المشروع والأفضل التبكير به قبل الزوال، لحديث: ( وما من مؤمن يظل يومه محرما إلا غابت الشمس بذنوبه.) صحيح الترغيب 
إذا تأخر حاج في لبس الإحرام إلى الليل لجلوس الحملة في السكن، فهل عليه شيء في ذلك التأخير؟, لا شيء عليه، لان لبس الإحرام من الظهر، أو في أي وقت في هذا اليوم ولو في الليل من المستحبات. 
من ترك الاغتسال؛ لضيق الوقت، فهل ارتكب خطأ؟, لا، بل حجه صحيح، لان الاغتسال من المستحبات، وفيه   الدلالة على تعظيم شعائر الله. 
الاغتسال في منى قبل الدخول في الإحرام، هل يجزئ؟, نعم، والأفضل الاغتسال قبل الإحرام في السكن، أو في أي مكان في مكة.  ح ِرم  
ما حكم من كان في منى قبل يوم التروية، هل يرجع لي من عند البيت الحرام، أم يحرم في منى؟,  الجالس في منى ُيشرع له أن يحرم منها، ويلبي من مكانه بالحج. 
وضع حاج مادة دهنية (جل) على رأسه حتى لا يتطاير شعره. هل يعد هذا من التطيب؟, هذا يسمى (التلبيد) وقد فعله النبي ، وإن كان فيه شيء من رائحة لم يقصد بها التعطر، فلا بأس به. 
امرأة رأت صفرة أو كدرة بعد تطهرها لليوم الثامن. ما الحكم عليها؟, لا شيء عليها، فالصحابيات كن لا يعتبرن الصفرة والكدرة شيئا. 
حاضت امرأة في هذا اليوم. فهل تخرج مع الحجاج إلى منطقة منى، أم أنها تجلس في السكن؟, لا ُيوثر هذا على إحرامها؛ ولها أن تخرج معهم وتؤدي جميع الإعمال، إلا طواف الإفاضة، فإنها تؤخره حتى تطهر. 
هل هناك من أدعية معينة بعد الإحرام؟,   يستحب الإكثار من التلبية في الطريق إلى منى، ثم التوقف عنها عند الجلوس فيها. 
ما حكم الدخول بعد منتصف الليل إلى منى، بسبب الزحام؟, لا حرج عليهم، والمبيت في منى في هذا اليوم من المستحبات. 
لم ُيصل الحاج أي صالة في منطقة منى في هذا اليوم، فهل عليه كفارة ألنه خالف السنة؟, ليس عليه أي شيء، لان الصلاة في منى أو في غيرها يوم التروية من المستحبات. 
هل المقصود بالمبيت مبنى هو النوم فيها؟, المقصود به: الجلوس فيها ليا، ولا يشترط فيه النوم. 
ما التوجيه للقول السابق من الشرع؟, يمكن توجيه القول من قوله تعالى: { َوا َل ِذي َن َيبِيتون لِ َر ّبِ ِه ْم  َو ِق َياما} (الفرقان: )64 أي يقضون ليلهم بالعبادة  َّج ًدا  ُس  والدعاء. 
هل يجوز جمع الصلاة مع قصرها في منى؟, سنة النبي في هذا اليوم قصر الرباعية فقط من غير جمع. 
ما حكم تخلف المريض عن الذهاب إلى منى ( يوم التروية )؟, لا شيء عليه، وبمقدوره التوجه إلى عرفة ليكون في راحة. 
هل يشرع التوجه إلى عرفة بدال من منطقة منى؟, يجوز الذهاب إلى عرفة مباشرة في هذا اليوم، أو ليلة التاسع. 
بعض الحجاج يصر على المضي إلى منى في هذا اليوم،   وإدارة الحملة تريد التوجه إلى عرفة. ما العمل؟, الواجب على الحاج حسن التعامل مع إدارة الحملة واستيعاب فقه أعمال الحج، وعدم الاختلاف مع إدارة الحملة. 
لماذا تتوجه بعض الحملات إلى عرفة بدال من منى؟, سبب هذا ليكون الحاج في راحة، وبعيدا عن الإجهاد والتأخير في بلوغ عرفة في يوم التاسع. 
من خرج آخر الليل إلى عرفات تفاديا للزحام، فهل تركه للمبيت مشروع أم عليه الفدية؟, لا حرج عليه - بإذن الله - والأمر فيه سعة. 
هل ُيشرع الحديث أثناء المبيت مع الأصدقاء؟, لا بأس بذلك إن كان الحديث بشيء نافع شرعا. 
إذا قام المحرم من نومه وهو محتلم، فهل فسد إحرامه؟, لم يفسد، لان الإحتلام وقع بغير قصد، فعليه أن يغتسل ويكمل نسكه. 
من وصل ظهرا في يوم الثامن فأدى العمرة، هل يكون متمتعا؟, قيل أنه لا يكون متمتعا من وصل إلى مكة بعد الظهر، لان وقت التمتع قد انتهى لدخول وقت الحج، والراجح الجواز لان أعمال اليوم الثامن مستحبة. 
هل بمقدور الحاج أن يعتمر ثم يؤدي الحج؟, نعم له ذلك، فبمقدوره أداء العمرة ثم يستريح أو يتوجه لعرفة.   
من لم يجد مكانا في منى، فهل يجب عليه التأجير؟, لا يجب عليه الدفع، إمنا يجلس في منى إذا وجد مكانا. 
من وجد مكانا خاليا، لكن لم يأت صاحب المكان، هل يجوز الجلوس فيه؟, لا يجوز هذا، إلا اذا علم أن صاحبه لن يمانع بجلوسه فيه. ألنه حق للجميع. 
ما الاصل في الجلوس في منطقة منى؟,  ِمنى الاصل فيه الأحقية بالجلوس لمن سبق، لقول النبي:[ « َمناخ من سبق.» أخرجه الترمذي وابن ماجه 
هل لهذا اليوم من فضل عند الله؟, نعم، فعن عائشة رضي الله عنها قالت : إن رسول الله [ قال: «ما من يوم أكثر من أن ُيعتق الله فيه عبدا من النار من يوم عرفة، وإنه ليدنو، ثم يباهي بهم الملائكة، فيقول: ما أراد هؤلاء؟.» رواه مسلم وقال :[ « إن الله يباهي بأهل عرفات أهل السماء فيقول لهم: انظروا إلى عبادي هؤلاء جاءوني شعثا غبرا.» رواه البيهقي وورد عن النبي قال: ...«وأما وقوفك عشية عرفة، فإن الله يهبط إلى سماء الدنيا فيباهي بكم الملائكة، يقول : عبادي جاؤوني شعثا غبرا من كل فج عميق يرجون رحمتي، فلو كانت ذنوبكم كعدد الرمل أو كقطر المطر، أو كزبد البحر لغفرتها، أفيضوا مغفورا لكم وملن شفعتم له .» رواه الطبراني 
ما سبب التسمية ب (عرفة)؟, قيل: إن الاسم جاء من أن الحجيج في هذا اليوم يعترفون بذنوبهم، وقيل: إن إبراهيم [ قال لجبريل ملا ب ّن له المناسك وسأله: عرفت؟ فقال :[ عرفت. وقيل: إن آدم وحواء تعارفا في هذا الموضع بعد وصولهم الإرض، والله أعلم بالصواب. 
ما أسماء يوم عرفة الأخرى؟, يسمى بيوم التمام، ويوم الحج الأكبر، واليوم المشهود.   
هل هناك من أصل شرعي لتسمية الجبل.. بالرحمة؟, ليس له أصل في السنة النبوية، لكن ُيقال له تاريخيا جبل الإل، أو الإل، ولو أطلق عليه جبل عرفة لكان أفضل. 
هل لجبل عرفة أي ميزة أو بركة شرعية؟, لم يرد عن النبي أي شيء من ذلك، ولا حتى عن الصحابة. 
هل الشاخص الموضوع على قمة جبل عرفة له أثر شرعي؟, ليس له أي بركة أو أثر شرعي، بل هو من الحدثات في العقود المتأخرة. 
ما حكم الوقوف بعرفة ؟, الوقوف بعرفة هو ركن الحج الأعظم، والنبي قال: « الحج عرفة .» رواه أبو داود 
متى يبدأ الوقوف بعرفة ؟, يبدأ من زوال شمس اليوم التاسع ( فترة الظهر)، وينتهي بطلوع فجر يوم العاشر (العيد.) 
ما معنى مصطلح: (الوقوف بعرفة)؟, هي مأخوذة من قول النبي :[ ( وقفت هاهنا، وعرفة كلها موقف) أي النزول، بأن يكون بها وقت الوقوف 
هل يتحقق هذا ولو للحظات؟, نعم ولو لحظة أو مارا أو قاعدا، للمعذور، ولا يقصد بها الوقوف دائما وعدم الجلوس.  
ما مثال المعذور؟, مثاله ما وقع للصحابي عروة بن المضرس الطائي قال: جئت رسول الله [ في الموقف فقلت: جئت يا رسول الله من جبلي طيء، أكللت مطيتي، وأتعبت نفسي، والله ما تركت من جبل إلا وقفت عليه، هل لي من حج؟ فقال رسول الله :[ (من أدرك معنا هذه الصلاة، وأتى عرفات قبل ذلك ليا أو نهارا، تم حجه وقضى تفثه.) رواه أحمد 
ما ُحكم التأكد من حدود منطقة عرفة؟, هذا من الواجبات، فمن كان خارج حدودها لم يتحقق له الوقوف الصحيح. 
هل صحيح أن وقوف النبي وافق يوم الجمعة؟, نعم، هذا صحيح. 
هل صلى النبي صالة الجمعة في هذا اليوم المبارك؟, لا، إمنا صلى الظهر والعصر، قصرا وجمعا. 
ما الدليل على عدم صالة النبي الجمعة، مع أنه خطب في هذا اليوم وقبل الصالة؟, الدليل على هذا أنه صلى ظهرا لا جمعة من وجوه كثيرة: - صلها ركعتن وسماها الراوي ظهرا. - صلى معها العصر قصرا وجمعا. - خطب خطبة واحدة قبل الآذان، والجمعة خطبتان. - خطب قبل الآذان، والقاعدة في الجمعة أنه يخطب بعد الآذان. - لم يجهر بالقراءة، والجمعة يجهر فيها بالقراءة .   
هل ُتشرع التلبية أثناء التوجه إلى منطقة عرفة؟, نعم، فقد كان الصحابة إذا غدوا من منى إلى عرفة مع رسول الله [ يهل منهم المهل فلا ينكر عليه، ويكبر منهم المكبر فلا ينكر عليه. رواه البخاري 
ماذا عمل النبي في هذا اليوم ؟, في اليوم التاسع من ذي الحجة جلس النبي خارج عرفة في بطن الوادي، ثم صلى في نمرة بأذان واحد وإقامتين للظهر والعصر، جمع تقدمي مع قصر الصلاة، وكان قد خطب فيهم خطبة الوداع، حتى أتى الموقف فجعل بطن ناقته القصواء إلى الصخرات، وجعل حبل المشاة بن يديه، واستقبل القبلة، وقام يدعو الله إلى مغيب الشمس. 
هل النزول بمنطقة نمرة من الواجبات؟, لا، بل هو مستحب إن تيسر، وإلا فلا حرج على الحاج إن لم ينزل بنمرة. 
ما حكم النزول بمنطقة ُعرنة؟,   ُعرنة هو من المستحبات قبل الدخول إلى عرفة لمن تيسر له. 
أين موقع نمرة وعرنة؟, كلاهما قبيل عرفة، ويقول الشيخ ابن عثيمين: « بطن  من عرفة، لكن مع ذلك لا يجوز الوقوف فيه، ... لان هذا ليس من عرفة شرعا، وإن كان منها تاريخيا.» 
حاج دخل مكة في هذا اليوم، هل يمكنه أن يدرك الحج؟,   نعم، فإن متكن من الطواف والسعي صباحا فله أن يحج متمتعا أو قارنا، وإلا فإنه يكون مفردا. 
إن احتاجت الحملة عند تجهيز المخيم إلى قطع بعض الأشجار في منطقة عرفة. فما حكم فعلهم؟, ينبغي عدم إفساد ما وضعته الحكومة، لان هذا ُيعد من التعدي على الممتلكات العامة، لكن لو وقع ممن يجهل هذا الإمر فلا إثم عليه في النسك، وألن عرفة من احلل وليست من الحرم. 
أثناء الطريق إلى المخيم احتاج حاج إلى تغطية وجهه بسبب الدخان والغبار، هل يجوز له ذلك؟, يجوز، وقد ورد عن عثمان بن عفان أنه قال: «كان [ ُيخمر (يغطي) وجهه وهو محرم»، لكن لا يغطي الرجل رأسه. 
