Question,Answer
هل شاة الفدية يجوز لذابحها الاكل منها؟,   لا، ألنها لفقراء مكة فقط، فإن أكل منها فعليه فدية أخرى. 
من اختار فدية الصوم، فهل يجب عليه أداء الصوم في مكة؟, له الصوم في أي زمان ومكان بعد الحج، ولا يلزم أن يكون في حال إحرامه. 
هل يشترط الصوم في مكان، أم في أي زمن ومكان؟, لا يشترط التحديد، فيجزئ الصوم بكل مكان، ألنه لا يتعلق بنفع شخص آخر، فيجزئ في كل مكان وزمان آخرين. 
ما حكم من ارتكب أكثر من محظور؟, الإمر يحتاج إلى تفصيل: فإن فعل المحرم محظورات من جنس واحد: كمن لبس قميصا وعمامة وسراويل، فليس عليه إلا فدية واحدة. وإن فعل محظورات من أجناس مختلفة: كمن حلق، ولبس مخيطا، وجامع أهله، فعليه فدية لكل محظور. 
مقولة: «من ترك نسكا أو نسيه فليهرق دما» ماذا تعني؟, هذا قول البن عباس، ولا يقوله من جهة الرأي، ولهذا فله حكم الرفع، وليس له مخالف من الصحابة، ويعني أن من ترك واجبا، عمدا أو سهوا أو جها؛ كرمي الجمار، أو المبيت  ُيذبح في مكة،  ليالي منى، وطواف الوداع، ونحو ذلك: دم ويقسم على الفقراء. سادسا: الممنوعات العامة:  
ما المحظورات العامة التي يشترك الرجل والمرأة في وجوب تجنبها مع الإحرام؟,   المحظورات العامة المشتركة: تقليم الأظفار، قص الشعر، استعمال الطيب (العطورات)، الجماع ومقدماته، النكاح والخطبة، صيد البر أو الإعانة عليه. 
هل الرجعة عن الطالق من المحظورات في الحج؟, لا، فتجوز الرجعة، والممنوع مع الإحرام : الزواج أو الخطبة. 
ماذا يقصد بحلق الشعر؟, المراد بحلق الشعر إزالته أو قصه بأي نوع من أنواع الإزالة مثل: القص - القطع - الحرق. 
ماذا يشمل المحظور في قص الشعر؟, يدخل في المنع جميع الشعر الذي بالبدن: الرأس، الشارب، اللحية، وغيره. 
هل ُيشرع للمريض أن يحلق شعره؟, نعم، لكن من حلق جميع شعره أو أكثره لعذر شرعي، بسبب القمل أو الأذى فعليه الفدية ولا إثم عليه، لحديث كعب .] 
هل السباحة أو الحك تعتبران من المحظورات؟, لا، حتى ولو سقط شعر، ألنه في حكم الشعر امليت. 
هل ُتشرع الحجامة للمحرم زمن الإحرام؟, تشرع؛ ولو احتاج لقص بعض شعره لموضع الحجامة فلا فدية عليه، ملا صح عن النبي :[ أنه احتجم وهو محرم، ولم يفد ولم يأمر بذلك. لكن إذا حلق المحرم أغلب شعره فعليه الفدية.   
ماذا يفعل من وضع الطيب على جسده أو ثوبه وهو محرم؟, عليه نزع الثوب وغسل الطيب من على جسده، لقول النبي للرجل الذي أحرم بجبة بعدما تضمخ بطيب: «أما الطيب الذي بك فاغسله ثلاث مرات، وأما اجلبة فانزعها.».. متفق عليه 
هل يشترط عند غسل الإحرام من الطيب زوال لونه؟, إذا تحقق المحرم من غسل الطيب وبقي لونه كالصفرة والحمرة فهذا لا يوثر عليه، لان الطيب زال وبقي لونه فقط. 
هل يؤثر بقاء لون ورائحة الطيب على الجسد بعد الإحرام؟, المنع في الطيب إمنا هو ابتداؤه وليس استدامته، يعني إذا تطيب قبل الإحرام ثم أحرم فإنه لا يلزمه غسله بعد ذلك. 
ماذا على من علم أن في ثوبه طيبا ولم يبادر لغسله مباشرة؟, إذا علم المحرم أنه يجب عليه غسل الطيب أو خلع الثوب ونحوه فبادر إلى الغسل أو النزع فلا شيء عليه؛ أما إذا تأخر  ًا ، ف المحرم قد استدامها وعليه الفدية.  تكاس  
هل قص الأظافر من الممنوعات على المحرم؟, نعم من الممنوعات في وقت الإحرام. 
ظفر يكاد أن يسقط، هل يجوز للمحرم أن يقطعه؟, يجوز قصه، ولا يعد هذا الفعل وقوعا في محظورات الإحرام. 
من قص من أظفاره بأسنانه بغير شعور. ما حكم ذلك؟, لا شيء عليه، ألنه لا يدخل في التعمد. 
ما الفرق بني القص والتقليم لأظافر؟,   القص: قطع أو إزالة مقدم الظفر ، أما التقليم: فهو ما يكون على جوانب الظفر. 
هل قطع الأظافر من الرجلين لهما حكم أظافر الأصابع؟, نعم، سواء في التعمد أو الجهل. 
هل قطع شيء من الشفة يعد من وقوع في المحظورات؟, لا شيء فيه، ألنه إزالة جلد ميت. 
هل يجوز استعمال السواك أو فرشاة الإسنان للمحرم؟, نعم يجوز ذلك بالنسبة للرجل والمرأة في كل حال ووقت، ولا يعد المعجون من التطيب. 
ما حكم وضع المراهم بعد الإحرام؟, يجوز، مادامت للعلاج أو للراحة، وبعيدة عن التطيب والترفه. 
هل يجوز التبرع بالدم من المحرم؟, نعم يجوز. سابعا: المحظورات على الرجال خاصة 
ما الواجب على المحرم من الرجال – خاصة - تجنبه؟, يحرم على الرجال خاصة بعد الدخول في النسك: تغطية الرأس بلبس ملاصق، وأيضا لبس المخيط (المحيط) للجسد. 
ما معنى قول الفقهاء: (ال يلبس الرجل المحرم المخيط)؟, المخيط: يقصد به ُلبس ما كان محاكا على قدر العضو، ويقال فيه المحيط (الإحاطة)،   
هل هذا التقييد من كالم النبي؟, لا، لكنه قيل أنه من كام التابعي إبراهيم النخعي. 
ما هو التوجيه النبوي في تحديد ما يلبسه المحرم؟, النبي حدد ما يحرم على الرجل لبسه، فقال: «لا يلبس القمص، ولا العمائم، ولا السراويلات، ولا البرانس، ولا الخفاف.» رواه البخاري 
هل يجوز للرجل المحرم لبس القفاز؟, لا يجوز له ذلك، لان النبي نهى عن الخفين وهما يستران القدمين، وكذلك القفازان يستران اليدين. 
من لم يجد نعلين، فماذا يفعل؟, له أن يلبس اخلفن، من غير قطع ملا فوق الكعب، ولا شيء عليه. 
هل ُيمنع المحرم من تغطية رأسه؟, نعم، يمنع من تغطية رأسه بملاصق، لقوله:(الا يلبس المحرم.. العمائم.) 
هل يجوز له استعمال المظلة وقت الإحرام؟, نعم 
هل حمل الأغراض على الرأس يعد من المحظورات؟, لا بأس به ولا يعد من تغطية الرأس. 
ما حكم تغطية المحرم للقدمين عند النوم؟, يجوز له ذلك. 
هل يجوز للمريض شد عصابة على رأسه بسبب الوجع؟, نعم يجوز هذا للحاجة، وليس هذا من محظورات الإحرام. 
هل هناك نوع مع ّني من النعال يشترط لبسها مع الإحرام؟, يجوز لبس أي نعال حن الإحرام ولو كان فيها خيط، إذ لم يحدد النبي شيئا معينا في ذلك. 
من لم يجد إزارا فماذا يفعل؟, من لم يجد إزارا جاز له لبس السراويل.   ثامنا: المحظورات على النساء خاصة 
ما الواجب على المرأة – خاصة - تجنبه عند إحرامها؟, يحرم عليها - خاصة - بعد الإحرام: لبس القفازين والنقاب، بالإضافة ملا تم ذكره من المحظورات العامة. 
هل البرقع له حكم النقاب في حال الإحرام؟, نعم لورود الحكم بكراهيته عن جمع من الصحابة، منهم ابن عمر وابن عباس وعائشة رضي الله عنهم. 
هل ُيشرع للمرأة أن تكشف وجهها في الحج ولا تنتقب؟, الأفضل التغطية، ويشرع لها تغطيته بأي ساتر غير النقاب، ولو كشفته فلا بأس، لحديث ابن عباس ] قال: «كان الفضل بن عباس رديف رسول الله [ فجاءت امرأة من خثعم، فجعل الفضل ينظر إليها وتنظر إليه، وجعل النبي يصرف وجه الفضل إلى الشق الآخر.» 
هل يجوز للمرأة أن تربط غطاء الوجه على الرأس؟, لا بأس بهذا، إن كان لا يثبت إلا بذلك. 
لو نسيت المرأة أن تخلع نقابها أو قفازيها. ما حكم ذلك؟, لا شيء عليها، لكن واجب المبادرة إلى خلعهما بعد التذكر. 
لم تخلع امرأة نقابها لوجود رجال، هل فعلها صحيح؟, للمرأة أن تغطي وجهها بأي شيء غير النقاب والبرقع، وإلا فإن عليها الكفارة بعد ذلك لتعمدها.   
هل يشترط في غطاء الوجه للمرأة الإ ميس الوجه؟, ليس هناك دليل على هذا الشرط. 
هل لبس المرأة للخف القماشي في القدم، ممنوع؟, غير ممنوع، ويجوز هذا لها. 
هل الكحل أو الحناء يؤثران على إحرام المرأة؟, لا يؤثران على الإحرام، لكن الواجب عليها إزالتهما حتى التلفت إليها النظر إن كانت لا تستر وجهها أو يديها. 
ما حكم وضع المحرمة للمكياج؟, لا ينبغي هذا، وخصوصا لتلك التي لا تغطي وجهها. تاسعا: ما يتعلق بأحكام الجماع 
ما المقصود بالجماع؟, المراد بالجماع: الإيلاج في فرج الأنثى من قبل الرجل. 
ما كفارة من جامع زوجته وهما محرمان؟, إذا شرع المسلم بالحج ثم جامع قبل التحلل الأول، فيترتب على ذلك أمور: يفسد حجهما، ويجب الاستمرار فيه، ويجب عليهما القضاء إذا كانت حجة الإسلام، وإن كانت نافلة فلا تجب الإعادة، ويجب التفريق من الموضع الذي جامع فيه، وعلى كل واحد منهما بدنة، والنفقة في حجة الإعادة تكون على الزوج. وإن أخر قضاء الحج مع الاستطاعة أثم.   
من جامع زوجته وهي مكرهة، فهل عليها الكفارة؟, لا شيء عليها، لأن من شروط الكفارة وجود إرادة للفعل. 
هل الحكم في الجماع يختلف إن وقع بعد عرفة؟, إذا كان الجماع بعد عرفة وقبل التحلل الأول ففيه أقوال عند الفقهاء، فجمهور العلماء حكموا بفساد حجه وعليه ما ذكر سابقا، وهناك أقوال غير أقوال الجمهور أن الحج صحيح، وعلى كل منهم بدنة (بعير .) 
هل على المباشرة بين الزوجين بدون جماع، كفارة؟, ليس فيها كفارة، لكن فيها الاستغفار والتوبة، وحجهما صحيح، ومن المباشرة: القبلة واللمس بشهوة. عاشرا: ما يتعلق بالصيد 
ما المقصود بالصيد المحظور على المحرم ؟, المراد بالصيد: صيد الحيوان الوحشي البري مأكول اللحم؛ مثل الغزال والجربوع، والطيور، ونحو ذلك مما يؤكل. 
ما أحوال المحرم مع الصيد ؟, بالنسبة لصيد المحرم فهو على ثلاثة أنواع :  ِصيد الصيد للمحرم، أو أعان عليه المحرم، فلا  الأول : إذا  يجوز له أن يأكله، وجاز لغيره. الثاني : إذا لم ُيصد له، ولا أعان عليه، جاز للمحرم أن يأكله. الثالث: إذا صاده المحرم، فعليه الإ يأكله هو ولا غيره، فيصبح كالميتة ويرمى.   
هل يشارك المعتمر في الإكل أناسا معهم صيد بري؟, نعم يشاركهم، إن لم يعاونهم في الصيد بأي وسيلة، ولو بالإشارة. 
مر معتمر على أناس يريدون الصيد. فأعانهم على بيان مكان الصيد. فهل فعله صحيح؟, أخطأ؛ وعليه الكفارة وهي التخيير بن ثلاثة أشياء: الأول: إما ذبح المثل، وتفريق جميع حلمه على فقراء مكة. الثاني: أن ينظر كم يساوي هذا المثل، ويخرج ما يقابل قيمته طعاما يفرق على المساكن، لكل مسكن نصف صاع. الثالث: صيام يوم عن كل صاع من الطعام. 
هل يجوز للمحرم الصيد من البحر في حال الإحرام؟, نعم، يجوز له صيد البحر وطعامه، حتى وإن كان معه الزاد. 
في الطريق رأى معتمر طيرا فصاده وأكله. ما حكم ذلك؟, يحرم على المحرم صيد البر، وهذا الفاعل عليه الفدية. 
إذا َو َج َد المحرم حلم صيد يباع هل يجوز له شراؤه ؟,  ُيصد له.  يجوز له ذلك، ألنه لم  
هل ذبح الحيوانات للأكل يعتبر صيد محظورا على المحرم؟, ذبح الحيوان الأهلي للأكل في حال الإحرام جائز كالشاة والإبل والبقر والدجاج ونحوها. 
هل َح َمام الحرم يعتبر من طيور الصيد؟, نعم، وأيضا لا يجوز تنفيره.   
من احتاج للصالة في موضع تجمع طائر الحمام في الحرم، ماذا يفعل؟, إن كان محتاجا للجلوس فيه، فإنه يدفع الحمام برفق ويجلس فيه؛ وإن لم يكن مضطرا فيذهب ملكان آخر. 
ماذا على من صاد من حمام الحرم ؟, على الفاعل الفدية، شاة توزع على فقراء مكة. 
هل ما يفعله الحاج من المعاصي ينقص من أجر الحج؟, المعصية مطلقا تنقص من ثواب الحج، لقوله تعالى: { َف َمن  ِّج.}  ِفي ا ْ َحل  ِج َدال  َال  ُف ُسوق َو  َال  َث َو  َا َر َف  َّج َف  َّن ا ْ َحل  َض ِفيه  َف َر  
ما ضابط الجدال المنهي عنه في الحج؟, الجدال أنواع : الأول: جدال ُيراد به إثبات حق بالحسنى، فهذا واجب، حتى وإن كان في الحج، مثل ما يحدث في المساومة عند الشراء، مع الحذر من رفع الصوت واللجاج في الكام. الثاني: جدال في أمور ليست حقا ولا باطا، مثل تخاصم الأصدقاء في أمور مباحة، فهذا منهي عنه لخشية حتريك النفس للباطل. الثالث: الجدال بالباطل، ومثاله الخصام بخاف احلق انتصارا للنفس المخطئة. ويقطع الجدال بسؤال أهل العلم، ليبعد الإنسان نفسه عن الإثم. 
هل المساومة في الشراء يعد من الجدال المذموم؟, لا يعتبر من الجدال المذموم، مع وجوب مراعاة اللن وحسن الكام فيه.  
ما الآداب التي ينبغي أن يتحلى بها المحرم (المعتمر)؟, ينبغي على المحرم أن يتحلى بالصبر، وغض البصر، وعدم الجدال أو الحديث إلا بالنافع من القول، وأن يكثر من التلبية والتهليل. 
هل طول الطريق والصبر عليه، فيه خير للحاج؟, نعم، يقول النبي :[ ( ما ترفع إبل الحاج رجا، ولا تضع يدا إلا كتب الله له بها حسنة، أو محا عنه سيئة، أو رفع بها درجة.) رواه البيهقي في الشعب 
لو احتاج المعتمر أن يصلي قبل مكة، فهل يؤديها قصرا؟, نعم يقصر الرباعية، وله أن يجمعها ألنه مسافر. 
من نام أكثر الطريق ولم يل ب إلا قليلا، ماذا عليه؟, لا شيء عليه ألنه قد أتى بالقدر الواجب من التلبية ولو مرة واحدة، والإكثار من التلبية فيه إظهار لسنة النبي، ويدرك المسلم بها أجرا كثيرا. 
إذا نقض الوضوء في الطريق. فهل يلزم التوضؤ للتلبية؟, لا يلزم للتلبية الوضوء، وللمعتمر مواصلة المسير. 
من لم يتمكن من التلبية إلا بصورة جماعية. ما حكم ذلك؟, الأولى في التلبية أن ُتؤدى بصورة فردية، فإن غلب   عليه مع أصحابه الدعاء الجماعي من غير قصد فلا بأس بذلك، والأمر فيه سعة. 
معتمر حرص على التغني بالتلبية، ما حكم ذلك؟, لا بأس به، ولعله من المعين في الاستمرار بالتلبية لطول الطريق، لكن يبتعد عن المبالغة والتكلف فيها خشية ترك التدبر. 
ما حكم زيادة ألفاظ أخرى على صيغة التلبية المعتادة؟, يجوز، عن أبي هريرة ] قال: «كان من تلبيته :[ لبيك إله احلق» رواه النسائي، وورد عن بعض الصحابة رضي الله عنهم تنوع صيغ التلبية، والأمر فيه سعة إن شاء الله. 
إن حك المعتمر رأسه فسقطت شعرات.. ما حكم ذلك؟, لا شيء عليه، لان هذا من الشعر امليت ولا يعد من القص.
  يقولون: إن حك الرأس يكون بالأصابع من غير عنف أو احتكاك! ما صحة قولهم؟, هذا من التكلف، وقد ورد عن عائشة رضي الله عنها أنها ُسئلت عن المحرم يحك جسده؟ فقالت: نعم فليحككه  ُربِطت يداي  وليشدد. رواه البخاري ومسلم ومالك. وزاد: ولو ولم أجد إلا رجلي لحككت.  
لطول الطريق وخشية الملل كان المعتمر يمازح أصدقاءه ويتكلم معهم ، فهل في هذا مخالفة للإحرام؟, ليس ممنوعا، لكن ينبغي على المعتمر خاصة مراعاة كامه فلا يقول إلا خيرا، والأولى شغل الوقت بالدعاء والذكر.  
سائق ُم ْح ِرم صدم حيوانا وقتله. هل عليه الكفارة؟, لا شيء عليه لعدم تفريطه، وألنه لم يكن في نيته الصيد. 
من تعطلت مركبته بعد تجاوزه الميقات فرجع إليه، هل يلزمه نزع الإحرام وتجديد النية ؟, لا يلزمه نزع الإحرام لشروعه فيه، وله أن يصلح سيارته في أي مكان، ثم يعود إلى إتمام عمرته. 
من نزل على مطعم فأكل طعاما مطيبا بالزعفران. هل يعد هذا من التطيب؟, لا يعّد من التطيب، لعدم قصده التطيب بالزعفران، والأولى الابتعاد عنه للحيطة. 
إذا نزل المعتمر في الطريق ورأى نبات الريحان فشمه، هل هذا يعد من استعمال الطيب؟, لا يعد هذا من التطيب، والأحوط البعد عن شمه. 
هل هناك من ضابط شرعي في قضية شم الطيب؟, نعم، فما حرم لكونه وسيلة وليس مقصودا لذاته؛ فإنه يجوز للحاجة، ومثاله: شم الطيب للمحرم محرم لكونه وسيلة إلى التطيب احمل ّرم على المحرم، فإذا شمه للترفه حرم، وإذا شمه للاستعلام، أي: ليستعلم الطيب وليعرف نوعه لكونه يريد شراءه فلا بأس؛ لكون ذلك للحاجة، وهذا عند ابن القيم وأما عند الفقهاء فلا يجوز مطلقا، أما الطيب فمحرم قصدا فلا يجوز مطلقا. 
من نزل منزلا في الطريق ماذا يستحب له قوله؟,   يستحب له قول ( أعوذ بكلمات الله التامات من شر ما خلق) فإنه لا يضره شيء حتى يرتحل من منزله ذلك. رواه مسلم 
ما حكم تغطية الوجه من الغبار بالثوب أو الكمام؟, لا يعتبر من الممنوعات، وروى الشافعي عن القاسم بن محمد بن أبي بكر قال: كان عثمان وزيد بن ثابت ومروان بن الحكم يخمرون وجوههم وهم محرمون. وقال مجاهد: كانوا (أي الصحابة رضي الله عنهم) إذا هاجت الريح غطوا وجوههم، وهم محرمون. ويجوز أيضا وضع الكمام للنساء، ولا يعد مشابها للنقاب. 
ما حكم الاستمرار بوضع الكمام على الوجه طوال فترة الإحرام؟, هذا غير مشروع، فالكمام لسبب محدد، فإن زال السبب وجب رفع الكمام. 
تغطية الرأس نسيانا بالإحرام لبرودة المكيف في الباص، هل يعد من المحظورات؟, لا شيء عليه لعدم قصده. 
هل يجوز للحائض قراءة كتب الأدعية وهي مح ِرمة؟, نعم، يجوز لها ذلك. 
أثناء الطريق شعرت المرأة بخروج دم منها لقرب موعد الدورة الشهرية، ما حكم إحرامها؟, لا حرج عليها من مواصلة التلبية والدعاء ، فإذا بلغت السكن عليها أن تتأكد من الخارج منها، ثم تعمل بما يتبن بعد ذلك.   
أثناء الطريق حصل لمحرم عارض (كمرض) منعه من أداء العمرة ولم يشترط ، فماذا يلزمه أن يفعل؟, إن أمكنه الصبر حتى يزول العارض ثم يكمل فهذا أفضل، وإن لم يصبر فهذا يكون في حكم المحصر، وينطبق عليه قوله  ِي}، وعليه أن  َن لا ه ْد  ِم  َس َر  َف َما اس َت ْي  ِص ْر ُ ْمت  تعالى: { َفإِن ُأ ْح  يهدي في محله الذي أحصر فيه، ويحلق أو يقصر ويتحلل، والنحر يكون في محله، ويعطيه للفقراء. 
من دخل مدينة أو قرية في الطريق، ماذا يستحب له قوله؟,  ّسبع وما أظللن،  ّسموات لا  ّب لا  يستحب له الدعاء: ( لا له ّم ر  ّشياط ِن وما أضللن، ور ّب  َن وما أقللن، ور ب لا  ور ّب الإرض  لا رياح وما َذرين، فلا نا نسأل َك خير ه ِذ ِه القرية، وخير َأ ْه ِلها،  َك من ش ِّرها وش ِّر َأ ْه ِلها وش ّر ما فيها.) رواه ابن خزمية  ونعوذ بِ  وحسنه ابن باز والألباني  
ما حكم استبدال الإحرام لوجود عرق أو وساخة؟, يجوز ذلك، وألي سبب. 
هل ُيشرع للمرأة تغيير ملابسها التي أحرمت بها؟, نعم، فليس هناك من مانع شرعي في ذلك. 
هل يجوز النظر في المرآة؟, نعم، وليس هناك من دليل يمنع ذلك. 
هل ُيشرع الاستحمام قبل العمرة؟, نعم، فقد ثبت فعله عن بعض الصحابة قبل أداء النسك. 
من امتنع عن الاستحمام خشية أن يتساقط شعر من الرأس، ماحكم فعله؟, هذا من التكلف، والحاج أو المعتمر بمقدوره أن يستحم، وما تساقط من شعر فإنه يعد شعرا ميتا لا يؤثر على الإحرام. 
هل يجوز استعمال المنظفات عند الاستحمام، والتي فيها بعض الرائحة المعطرة؟, المنظفات التي يقصد بها التعطر لا يجوز استعمالها، وإذا كان الصابون والشامبو من المنظفات المعتادة اليومية فلا بأس باستعمالهما، ولو كانت فيهما روائح عطرية غير طبيعية لتكون مقبولة في الاستعمال.   
