Question,Answer
هل يجوز الخروج في أول الليل لشدة الزحام، وليتيسر أداء بقية الإعمال بعيدا عن المشقة؟,   الخروج أول الليل لم تثبت الرخصة فيه عن النبي، ولذا لا يجوز التهاون في الخروج إلا بعد ذهاب أكثر الليل. 
المرافق للضعفة والعجزة هل يؤدي معهم الرمي والطواف وغيرها من أعمال الحج؟, نعم، رفقاؤهم معهم، يرمون معهم، ويفعلون مثل أعمالهم. 
إذا خرج الرجال من مزدلفة ليال مع النساء، فرموا وطافوا الإفاضة وحلقوا. فهل عملهم صحيح؟, رخص النبي للنساء وللضعفة في الخروج من مزدلفة آخر الليل ليرموا جمرة العقبة الكبرى، ويدل هذا على أن الرمي قبل طلوع الشمس في حق هؤلاء لا بأس به، ولهذا رمت أم سلمة قبل الفجر، ثم ذهبت وأفاضت إلى مكة، وهكذا روت أسماء أن النبي أذن للنساء بذلك. 
المرأة النشيطة القوية، هل تدخل في حكم الضعفة؟, نعم، فالنساء كلهن من الضعفة، وإن صبرت المرأة لأداء السنة إلى الفجر فهذا أفضل في حقها. 
ما حكم من يؤذن للفجر قبل وقتها في مزدلفة؟, هذا خطأ عظيم، فإن الصلاة قبل وقتها غير مقبولة، وبمقدور الإنسان معرفة الوقت من التقويم. 
هل صالة الفجر واجب أداؤها في أول الوقت؟, نعم، فتصلى أول الوقت، ليتمكن الحاج من التوجه إلى المشعر الحرام قبل شروق الشمس إن تيسر له ذلك، أو غيره.   ثانيا: ما يتعلق بالمشعر الحرام: 
ما المقصود بالمشعر الحرام؟, هو جبل صغير في مزدلفة، حث الله تعالى المسلمين أن يذكروه عنده قبل الخروج من مزدلفة، قال تعالى: { َفإِ َذا  ْش َع ِر ا ْ َحل َرام َواذ ُك ُروه  َفاذ ُك ُروا الل َه ِعند ا ْملَ  َع َر َفات  ْض ُتم ِّم ْن  َأ َف  َن} (البقرة)198:  َق ْب ِل ِه َملِ َن الضآل  ِّمن  َوإِن ُكنتم  َه َداك ْم  َك َما  
متى يتوجه الحاج إلى هذا المكان؟, بعد صلاة الفجر من صباح يوم النحر - اليوم العاشر من ذي الحجة- في أرض مزدلفة. 
ما حكم الدعاء عنده؟, مستحب، لمن تيسر له ذلك. 
ماذا فعل النبي عند المشعر الحرام؟, ورد في حديث جابر: ...( ثم ركب- أي النبي | - القصواء حتى أتى المشعر الحرام، فاستقبل القبلة فدعاه وكبره وهلله وحده، فلم يزل واقفا حتى أسفر جدا .) رواه مسلم 
متى انصرف النبي من مزدلفة؟, ملا صلى النبي الفجر فيها، لم ينصرف منها حتى أسفر الوقت، فلما أسفر انصرف قبل أن تطلع الشمس على منى. 
بعد الفجر لم يتمكن حاج من الذهاب إلى المشعر الحرام للدعاء عنده امتثالا لسنة النبي فما الحكم؟, الوقوف عند المشعر الحرام (مسجد المشعر الحرام) من المستحبات،  ولا شيء على من تعذر عليه الوقوف عنده للدعاء. 
من لم يخرج من مزدلفة إلا بعد طلوع الشمس، ماذا عليه؟, هذا الفعل مكروه، ولا شيء عليه من الفدية. 
هل بمقدور الحاج تغيير إحرامه بعد ليلة مزدلفة؟, نعم له ذلك. 
من أراد التوجه للسكن ليرتاح، قبل المضي لأداء بقية الإعمال، فما حكم صنيعه؟, لا بأس في هذا، ولعله رجاء أن يقل الزحام.  اولا: معلومات عامة: 
ما سبب تسمية هذا اليوم ب ( يوم النحر)؟, لان فيه شعيرة عظيمة وهي نحر الهدي والأضحية لله سبحانه، ولها تعلق بالعيد، واقتداء بسنة الخليل إبراهيم .[ 
ما أهمية هذا اليوم؟, مما يدل على أهميته اجتماع العبادات فيه. 
أي يوم هو يوم النحر؟, هو يوم العاشر من ذي الحجة. 
ما أعمال هذا اليوم؟, أعمال هذا اليوم: رمي جمرة العقبة الكبرى بسبع حصيات، ثم نحر الهدي لمن كان متمتعا أو قارنا، وبعدها الحلق أو التقصير، ثم الطواف والسعي، ثم التحلل من الإحرام، المبيت في ِمنى لاول ليالي التشريق. 
ما حكم أعمال هذا اليوم؟, طواف الإفاضة مع السعي من أركان الحج، أما رمي جمرة العقبة والنحر والحلق أو التقصير والمبيت فمن الواجبات. 
هل ترتيب أعمال يوم النحر على التخيير أو الإلزام؟,   هي على التخيير تيسيرا على الإمة، والنبي ما ُسئل في هذا اليوم  ِخر، إلا قال: « افعل ولا حرج .» رواه البخاري  ُق ِدم أو ُأ  عن عمل  
هل يمكن تقدمي السعي على الطواف في هذا اليوم؟, يجوز، لان النبي سئل عمن سعى قبل أن يطوف، فقال: (الحرج.) رواه أبو داود 
كيف يؤدي المريض أعمال يوم النحر؟, الإمر يسير، فله أن ُيؤخر الطواف والسعي حتى يبرأ، والرمي له فيه التوكيل، ويوكل أيضا من يقوم بالنحر عنه، ويمكن أن يقصر من شعره أو يحلق وهو في سكنه (العمارة.) 
ما المقصود بالتحلل؟, المقصود بالتحلل أن الحاج أو الحاجة يجوز لهما فعل  ُمنِعا عنها بالإحرام، مثل قص الشعر  المحظورات التي  والتطيب والجماع، وغيرها من الامور. 
هل هناك أنواع في التحلل؟, نعم، تحلل أصغر (الأول:) وهو لمن فعل أمرين من ثلاثة أمور في هذا اليوم ( وهي: الرمي، والطواف مع السعي، والحلق)، وفيه جواز فعل ما تم حظره إلا الجماع (التمتع بالزوجة.) وتحلل أكبر ( الثاني :) وهو لمن فعل جميع الإعمال، وله فعل جميع ما حظر عليه أثناء الإحرام، ومنها الجماع. 
هل يمكن أن يقع التحلل الأصغر بفعل أمر واحد؟, هذا ممكن مثلما أفتى بذلك الشيخ الإلباني رحمه الله في   منسكه، وقال الشيخ ابن باز في فتاويه عن هذا: «وهو قول قوي، وإمنا الأحوط هو تأخير التحلل الأول حتى يحلق المحرم أو يقصر، أو يطوف طواف الإفاضة ويسعى إن كان عليه سعي بعد جمرة العقبة»، ويرى الشيخ ابن عثيمين وجوب فعل أمرين لتحقيق التحلل الأول. 
ما دليل الشيخ الإلباني رحمه الله؟, دليله ما ذكرته أم المؤمنين عائشة رضي الله عنها أنها قالت: ( طيبت رسول الله [ بيدي بذريرة حلجة الوداع، للحل والإحرام، حن أحرم، وحن رمى جمرة العقبة، يوم النحر قبل أن يطوف بالبيت.) أخرجه أحمد، وأبو عوانة 
من جامع زوجته قبل التحلل الثاني، وكان جاهلا، ماذا عليه من كفارة؟, إن كان جاها فلا شيء عليه. 
وإذا كان على علم بالحكم، فماذا عليه؟, إن كان عاملا فعليه الاتي: - الخروج إلى احلل ويحرم ليطوف الإفاضة محرما، ألنه فسد إحرامه، ووجب عليه أن يجدده.   - وعليه الفدية: شاة يذبحها ويوزعها على الفقراء، أو يطعم ستة مساكن، لكل مسكن نصف صاع، أو صيام ثلاثة أيام 
ما المقصود بالعقبة الكبرى؟, يقصد به الطريق المعترض للناس، وهذا كان موجودا في الزمان الماضي، وهو في آخر منطقة منى من جهة مكة. 
هل هناك من خبر تاريخي متعلق بهذا الموضع؟, نعم، فهو الموضع الذي بايع النبي الانصار عنده قبل الهجرة. 
ما المقصود بالجمرة؟,  ِجمار.  يقصد بها الحجارة الصغيرة مثل الجمرة، وجمعها 
ما فضل رمي الجمرة؟,  عن ابن عباس قال : قال رسول الله :[ (إذا رميت الجمار كان لك نورا يوم القيامة.) رواه البزار 
بعض الناس يطلق على عبادة رمي الجمرات مصطلح : (الرجم)، ما صحة قوله؟, غير صحيح، فالرجم هو عقوبة للمذنب، ولكن الحاج يفعل عبادة عند رمي الجمرات. 
هل من رمى جمرة العقبة فقط.. َيحل له كل شيء إلا النساء؟,   استدل بعض العلماء على جواز ذلك بما ثبت عن ابن عباس رضي الله عنهما قال: قال رسول الله :[ «إذا رميتم الجمرة؛  ّل كل شيء إلا النساء.» السلسلة الصحيحة - برقم  فقد ح  .)239( والراجح - والله أعلم- لاجتماع الادلة، زيادة أمر مع الرمي، فإن أتى مع الرمي مثل الحلق، أو الطواف ومعه السعي فقد تم التحلل الاصغر. 
من أين تلتقط الجمرات (الحصى ) في هذا اليوم؟, من أي مكان في مكة، وليس هناك موضع محدد. 
ما حكم بيع الحصى للرمي؟, لا بأس في هذا، فهو مكافأة لمجهود من جمع الحصى. 
ما حجم الحصاة المقررة للرمي؟, ينبغي أن تكون مثل حصى الخذف (الرمي)، التي ترمى بأصبعين، (السبابة والإبهام) وحجم الحصاة يكون أكبر من حبة الحمص وأصغر من البندق، أو بمقدار نصف الأنملة. 
لم كان عدد الحصى سبعة؟, هذه سنة النبي، واقتداء بما فعله الخليل إبراهيم .[ 
من رمى الحصى كلها دفعة واحده، هل فعله صحيح؟, غير صحيح، وتعتبر واحدة، وعليه رمي ست أخرى. 
هل يشترط الرمي باليد اليمنى؟, لا يشترط ذلك. 
هل يشترط غسل الحصى؟,   لا يشرع غسلها، بل هو بدعة. 
كيف رمى النبي جمرة العقبة؟, ورد أن عبد الله بن مسعود ] جعل البيت عن يساره، ومنى  ُمقام الذي  عن يمينه ورمى الجمرة بسبع حصيات، وقال: (هذا أنزلت عليه سورة البقرة.) متفق عليه 
هل يشترط في الرمي فعله من جهة معينة؟, لا يشترط هذا، والأمر فيه سعة في جهات الرمي. 
ما حكم الحرص على رمي الشاخص بالحصى؟,  لا ُيشرع رمي الشاخص، إمنا المقصود وقوع الحصى في الحوض. 
ما حكم تأجيل الرمي بعد مغيب الشمس تفاديا للزحام؟, يجوز ذلك، لان النبي رخص للرعاة بالرمي ليا والرعي بالنهار. 
ما نهاية وقت الرمي في يوم النحر؟, وقت رمي جمرة العقبة الكبرى في هذا اليوم ممتد إلى قبل فجر اليوم الثاني 11( / من ذي الحجة .) 
إن كان الحاج مريضا، فهل يمكن أن يوكل من يرمي عنه؟, نعم، له أن يوكل (ينيب) إن منعه العذر. 
لطول المسافة في بلوغ الجمرات أوكلت المرأة الرمي إلى زوجها. ما صحة فعلها؟, صحيح، فالمشقة موجودة، فإذا تعذر الوصول لرمي الجمرات   ولو بالجلوس على كرسي متنقل فلها التوكيل. 
ما ضابط عدم قدرة المرأة في املشي؟, ليس هناك من ضابط شرعي، ولعل الضابط العرفي يحدد القدرة وهو أنها لا تستطيع التجول في الأسواق. 
هل ينقص الاجر إن لم يقم الحاج بالعبادة بسبب التوكيل؟, إن كان التوكيل لعذر شرعي فالعبادة صحيحة. 
هل يشترط أن يكون الوكيل محرما للمرأة الحاجة؟, لا يشترط ذلك، فهي كالحاج يمكن أن ينوب عن أصحاب الاعذار. 
هل هناك من عدد محدد في الإنابة عنهم في الرمي؟, لا ح ّد لهم في التوكيل، فيمكن الإنابة عن واحد وأكثر. 
هل في التوكيل صيغة معينة تدل على التوكيل؟, ليس هناك من صيغة معينة، ودلالة الموافقة في الرمي عن الغير من أصحاب الإعذار تكفي. 
هل يرمي الحاج عن نفسه أولا، أو عن الموكل عنه؟, الإمر فيه سعة، وإن بدأ بنفسه فهو أفضل. 
هل يجب الانتهاء من الرمي عن النفس برمي الجمرات، ثم يرجع للرمي عن المنوب عنه؟, لا، بالمقدور الرمي عن النفس ثم عن المناب عنه عند الأول، وكذا في الثاني، وأيضا في الأخير. 
مقولة: «المرأة عورة» وعليها الإ تزاحم الرجال، فينبغي   التوكيل عنها دائما. هل هذا الفهم صحيح؟, المرأة ليست عورة، لكن العورة أن تكشف ما لا يحل كشفه أمام الأجانب، وأما شخص المرأة فليس بعورة، فإذا خافت المرأة من الزحام فلها تأخير الرمي إلى الليل مع وليها. 
هل هناك من دعاء قبل رمي الحصاة عند العقبة الكبرى؟, هناك التكبير مع كل حصاة ، لحديث جابر :] أن رسول الله كان يكبر مع كل حصاة. رواه مسلم 
لبعد المسافة أثناء الرمي عن موضع رمي الجمرات ، فهل على الحاج من حرج لو أخذ حجارة كبيرة؟, لا يجوز، لان النبي حدد حجم حصى الرمي عندما أمر ابن عباس أن يلقط له الحصى، فقال: «هكذا ، وإياكم والغلو»، والمسلم بإمكانه أن ينتظر قليا، ثم يقترب من مكان الرمي مع التوسعة الجديدة، أو له تأخير وقت الرمي إلى الليل. 
لم تسقط إحدى الجمرات في الحوض، لكن الحاج أصاب الشاخص ( العمود.) فهل عليه إعادة؟, إصابة الجدار، أو سقوط الحصاة في الحوض يجزئ في الفعل، والأمر الإن متيسر مع التوسعة الجديدة ملكان رمي الجمرات الثلاث. 
نقصت صخرة من يد الحاج، فمن أين يأخذها؟, يأخذها من أي مكان عند رمي الجمرات، أو من أي إنسان. 
بعد الفراغ من رمي الجمرات تبقى لدى الحاج عدد من الجمرات يسير فرماها في مكان الرمي. فهل عليه إثم؟,   إن كان لا يقصد الزيادة على العبادة، فيجوز. 
هل يجوز الرمي بأي شيء بعد الفراغ من رمي الجمرات؟, لا يجوز، فالرمي عبادة واتباع، وليست وفق الأهواء والعاطفة، والواجب على المسلم الاقتداء بسنة النبي .| 
هل الشيطان في مكان رمي الجمرات؟, لا، لكن أصل الفعل أن الشيطان ظهر لنبي الله إبراهيم | ليثنيه عن ذبح ابنه إسماعيل، فرماه إبراهيم [ بسبع حصيات، وكرر هذا الفعل وأصبحت سنة لنا، ونحن نقتدي بفعل النبي .| 
ما حكم شتم أو لعن الشيطان أثناء الرمي؟, كل ذلك من فعل الجهلاء، والواجب الإتباع وليس الابتداع. 
بعد الفراغ شك المسلم: هل رمى سبعا أو ستا! فهل عليه أن يرجع ويعيد الرمي؟, الشيء عليه، ولا إعادة على من شك بعد الفراغ من العبادة. 
هل هناك من دعاء بعد الفراغ من رمي جمرة العقبة الكبرى؟, لا دعاء، فعن ابن عباس ] قال: كان | إذا رمى جمرة العقبة (أي الكبرى) مضى ولم يقف. 
ماذا يفعل من ترك رمي جمرة العقبة الكبرى في هذا اليوم؟, يرميها في اليوم التالي قبل أن يرمي جمرة أيام التشريق. 
هل مشروع التأخير في الرمي؟, لا يجوز هذا الفعل لمخالفته السنة.   
ما مشروعية التقاط الجمرات جميعها للأيام القادمة؟, يلتقط حصى كل يوم بيومه، ولو لقطها كلها في يوم واحد جاز. 
هل تنتهي التلبية بعد رمي الجمرة؟, نعم، وهذا ما عمله النبي .| 
ما المشروع قوله من دعاء بعد انقطاع التلبية؟, ُيشرع التكبير، امتثالا لقوله تعالى: {و َي ْذ ُك ُروا اس َم لا ل ِه ِفي َأ َّيام  ِم ْن َب ِهيم ِة ا ْ َأل ْن َعام .} (احلج)28:  َر َز َق ُه ْم  َما  َع َلى  َم ْع ُلومات  
ما الحكم مع من لم يتمكن من رمي جمرة العقبة في يوم النحر حتى طلع الفجر؟, يرميه في اليوم التالي، قال الشيخ ابن باز رحمه الله: «وإن أخره خروج ًا من اخلاف ورماه بعد الزوال عن يوم العيد للنية، ثم رمى ذلك اليوم، الحادي عشر بإحدى وعشرين حصاة عن ذلك اليوم بعد الزوال كان ذلك حسنا أيضا، وفيه خروج من اخلاف.»: 
ما الوصف الذي يطلق على ما ينحره الحاج؟, ُيقال له الهدي. 
هل على من حج مفردا هدي؟, ليس عليه هدي، لان الهدي فقط على القارن والمتمتع. 
من أوقف لنفسه وقفية الأضحية في إحدى اللجان الخيرية، هل يسقط عنه الهدي؟, لا، لان الهدي واجب على الحاج، والأضحية لغيره. 
ما الفرق بني الهدي والفدية؟, الهدي يكون حلج القران أو التمتع، والفدية: بسبب ارتكاب محظور من محظورات الإحرام، والهدي يجوز لصاحبها الإكل منه، والفدية لا يجوز الإكل منها. 
ما الإنعام (الحيوانات) التي يكون فيها الهدي؟, تكون في الغنم، والماعز، والبقر، والإبل، ويجزئ فيها أي جنس من هذه الإنعام. 
ما الشروط الواجب مراعاتها في هذه الحيوانات؟, الشروط هي: 1 - بلوغ السن المجزئ (الثني من الإبل والبقر والنعاج – الجذعة من الضأن.) 2 - السامة من العيوب. 3 - أن يكون النحر في أيام العيد الأربعة.   4 - أن يكون النحر في أميال الحرم، (منى، مزدلفة، طرق مكة.) 
ما السن المعتبرة في الهدي؟, ستة أشهر للضأن (جذعه) - سنة للماعز ( ثني ) - سنتان للبقر - خمس سنوا ت للإبل. 
بأي نوع من الحيوانات كان هدي النبي؟, كان هديه من الإبل. 
كم عدد الهدي للنبي [ ؟, بلغ عدده مائة من الإبل، ونحر النبي بيده الشريفة ثلاثا وستين بعيرا، وأكمل علي ] نحر الباقي. 
هل يمكن التوكيل في فعل النحر؟, نعم، والنبي أمر عليا ] أن ينحر عنه بقية هديه في الحج. 
هل النحر له عالقة بالتحلل من الإحرام؟, لا عاقة للنحر بالتحلل من الإحرام. 
ما حكم من نحر هديه في منطقة احلل؟, هدي المتمتع والقران لا يصح ذبحه إلا في منطقة الحرم. 
ماذا يفعل من ليس عنده مال للهدي؟, له أن يصوم ثلاثة أيام في الحج، وسبعة إذا رجع إلى أهله. 
هل الإطعام في الهدي يتوجه لجهات محددة؟, نعم، فالهدي متوجه اولا لإطعام مساكن الحرم، ثم ما زاد   منه فبالمقدور توزيعه على المساكن خارج مكة. 
ما دليل مشروعية توزيع حلوم الهدي خارج مكة؟, دليل ذلك ما ذكره جابر ] أنه قال: «كنا نتزود حلوم الهدي على عهد رسول الله [ إلى المدينة.» رواه البخاري 
هل يمكن اشتراك مجموعة حجاج في هدي واحد؟, يجوز، فيشتركون في بدنة (بعير أو بقرة) وهي تكفي عن سبعة أشخاص، لقول جابر :] حججنا مع رسول الله [ فنحرنا البعير عن سبعة، والبقرة عن سبعة. رواه مسلم وأحمد 
ما أقل عدد مجزئ في الهدي؟, أقل ما يجزئ فيه: شاة، وهو عن شخص واحد. 
هل بمقدور الحاج الزيادة في عدد الهدي ؟, نعم، والنبي كان هديه مائة من الإبل. 
هل يجب شهود الحاج النحر، ويباشره بيديه، والأكل منه؟, لا يجب كل ذلك، لكن يستحب له الإكل منه. 
هل يشترط أداء النحر في المجازر (أماكن النحر)؟, نعم، فواجب الاهتمام بنظافة طرق المسلمين، واعانة والة الإمر في تنظيم الإعمال وحسن أدائها في أماكنها. 
هل على الحاج الصغير هدي؟, الصغير حكمه كحكم الرجل البالغ في الهدي، ومثله الجارية. 
هل يجوز للمرأة الحائض أن تنحر هديها أو الأضحية؟,   نعم، ولا علاقة بصحة النحر بالحيض أو النفاس. 
هل يجوز تأجيل النحر إلى اليوم الثاني أو الثالث من العيد؟, يجوز ذلك، لحديث: «كل أيام التشريق ذبح .» رواه أحمد 
ماذا لو فات شخصا الذبح في أيام التشريق؟, يجوز في الهدي الذبح ولو بعد أيام التشريق، أما الأضحية فإن غابت شمس اليوم الثالث عشر فقد فاتت السنة بها. 
هل يمكن إخراج حلوم الهدي خارج مكة؟, نعم، فقد ورد بأن الصحابة كانوا يتزودون بلحوم الهدي على عهد رسول الله [ إلى المدينة. أخرجه أحمد رابعا: الحلق أو التقصير: 
هل للحلق أجر مخصوص؟, نعم، له ثلاث رحمات من الله سبحانه، وأيضا قول النبي :[ ( أما حلقك لرأسك، فإن لك بكل شعرة تسقط حسنة.) رواه الطبراني 
هل على النساء حلق؟, لا، قال ابن عباس :] « ليس على النساء حل ٌق، إمنا على النساء التقصير.» رواه أبو داود 
كيف يكن التقصير للمرأة؟, تقص من طرف شعرها قدر الانملة، أي طرف الإصبع. 
من لم يتحلل.. هل بمقدوره قص شعر غيره؟,   لا بأس في هذا. 
ما الحكم في أخذ الرجل شعرات متفرقة من الرأس ليتم التقصير؟, التعميم بالأخذ من جميع شعر الرأس بالتقصير أو الحلق هو الوارد بالسنة النبوية الفعلية. 
من فعل الإمر السابق، هل يعيد التقصير؟, لا إعادة عليه، لجهله، ولو ورود القول فيه من بعض المذاهب، 
هل هناك من دعاء مع ّني يقوله الحاج عند احلالقة؟, لم يثبت بالشرع تخصيص دعاء معن عند الحلق أو التقصير. 
هل هناك من زمن مخصص لأداء الحلق أو التقصير؟, ليس له وقت له محدد، فلا بأس بفعله في أي وقت من هذا اليوم. 
هل هناك من موضع معني للحلق، لان النبي حلق في منى؟, يجوز في أي موضع من مكة. 
